Rank,Recommended action,Score impact,Points achieved,Status,Regressed,Have license?,Category,Product,Last synced ,Microsoft update,Notes
194,Set action to take on high confidence spam detection,+0.37%,	5/5,Completed,No,Yes,Apps,Defender for Office,1/5/2023,None,
195,Set action to take on high confidence phishing detection,+0.37%,	5/5,Completed,No,Yes,Apps,Defender for Office,1/5/2023,None,
196,Set action to take on spam detection,+0.37%,	5/5,Completed,No,Yes,Apps,Defender for Office,1/5/2023,None,
197,Create an OAuth app policy to notify you about new OAuth applications,+0.29%,	4/4,Completed,No,Yes,Apps,Microsoft Defender for Cloud Apps,1/5/2023,None,
198,Create an app discovery policy to identify new and trending cloud apps in your org ,+0.22%,	3/3,Completed,No,Yes,Apps,Microsoft Defender for Cloud Apps,1/5/2023,None,
199,Create zero-hour auto purge policies for phishing messages,+0.22%,	3/3,Completed,No,Yes,Apps,Defender for Office,1/5/2023,None,
200,Set action to take on bulk spam detection,+0.22%,	3/3,Completed,No,Yes,Apps,Defender for Office,1/5/2023,None,
201,Ensure spam safety tips are enabled,+0.22%,	3/3,Completed,No,Yes,Apps,Defender for Office,1/5/2023,None,
202,Enable the domain impersonation safety tip,+0.22%,	3/3,Completed,No,Yes,Apps,Defender for Office,1/5/2023,None,
203,Enable the user impersonation safety tip,+0.22%,	3/3,Completed,No,Yes,Apps,Defender for Office,1/5/2023,None,
204,Enable the user impersonation unusual characters safety tip ,+0.22%,	3/3,Completed,No,Yes,Apps,Defender for Office,1/5/2023,None,
205,Create a custom activity policy to get alerts about suspicious usage patterns,+0.15%,	2/2,Completed,No,Yes,Apps,Microsoft Defender for Cloud Apps,1/5/2023,None,
206,Ensure that no sender domains are allowed for anti-spam policies,+0.15%,	2/2,Completed,No,Yes,Apps,Defender for Office,1/5/2023,None,
207,Designate more than one global admin,+0.07%,	1/1,Completed,No,Yes,Identity,Azure Active Directory,1/4/2023,None,
208,Use least privileged administrative roles,+0.07%,	1/1,Completed,No,Yes,Identity,Azure Active Directory,1/4/2023,None,
209,Create zero-hour auto purge policies for spam messages,+0.07%,	1/1,Completed,No,Yes,Apps,Defender for Office,1/5/2023,None,
210,Don't add allowed IP addresses in the connection filter policy ,+0.07%,	1/1,Completed,No,Yes,Apps,Defender for Office,1/5/2023,None,
211,Retain spam in quarantine for 30 days,+0.07%,	1/1,Completed,No,Yes,Apps,Defender for Office,1/5/2023,None,
212,Set the email bulk complaint level (BCL) threshold to be 6 or lower,+0.07%,	1/1,Completed,No,Yes,Apps,Defender for Office,1/5/2023,None,